{
  "schema_version": 1,
  "upstream_version": "6.5.0",
  "upstream_commit": "740ad964dc2397f33e40944367b0536a7314cc32",
  "entries": [
    {
      "identity": "ant.component.button",
      "status": "partial",
      "summary": "RynUI 已提供 typed Button、三种核心类型、三档尺寸、禁用/加载和 pointer/keyboard/focus 交互；完整 Ant Web 变体仍未覆盖。",
      "supported_scope": [
        "Default/Primary/Danger types",
        "Small/Middle/Large sizes",
        "disabled and loading priority",
        "pointer/keyboard/focus-visible interaction",
        "Theme component tokens"
      ],
      "missing_scope": [
        "dashed/text/link/ghost and preset color variants",
        "icon placement public contract",
        "wave effect",
        "complete Ant Design Web API"
      ],
      "evidence_identifiers": [
        "openspec:004-20260827-build-button-interaction-foundation",
        "test:rynui.button_component",
        "test:rynui.button_scene_service",
        "test:rynui.keyboard_activation"
      ]
    },
    {
      "identity": "ant.component.float-button",
      "status": "planned",
      "summary": "悬浮按钮（FloatButton）的 Ant Design 6.5.0 参考条目；RynUI 尚未提供对应的稳定公开组件。",
      "supported_scope": [
        "仅保留锁定版本的离线参考元数据"
      ],
      "missing_scope": [
        "对应 RynUI 稳定公开组件与交互合同"
      ],
      "evidence_identifiers": [
        "source:components/float-button/index.en-US.md"
      ]
    },
    {
      "identity": "ant.component.icon",
      "status": "planned",
      "summary": "图标（Icon）的 Ant Design 6.5.0 参考条目；RynUI 尚未提供对应的稳定公开组件。",
      "supported_scope": [
        "仅保留锁定版本的离线参考元数据"
      ],
      "missing_scope": [
        "对应 RynUI 稳定公开组件与交互合同"
      ],
      "evidence_identifiers": [
        "source:components/icon/index.en-US.md"
      ]
    },
    {
      "identity": "ant.component.typography",
      "status": "partial",
      "summary": "RynUI 已提供 Theme 驱动的 Text、CJK/Latin 排版与 retained 文本渲染，但尚未覆盖 Ant Design Typography 的完整语义集合。",
      "supported_scope": [
        "typed Text props",
        "CJK/Latin shaping and rendering",
        "Theme typography tokens",
        "retained text scene"
      ],
      "missing_scope": [
        "Title/Paragraph/Link public components",
        "editable/copyable/ellipsis contracts",
        "complete Ant Design Typography variants"
      ],
      "evidence_identifiers": [
        "openspec:003-20260827-build-text-component-foundation",
        "test:rynui.text_component",
        "test:rynui.text_component_frame"
      ]
    },
    {
      "identity": "ant.component.divider",
      "status": "planned",
      "summary": "分割线（Divider）的 Ant Design 6.5.0 参考条目；RynUI 尚未提供对应的稳定公开组件。",
      "supported_scope": [
        "仅保留锁定版本的离线参考元数据"
      ],
      "missing_scope": [
        "对应 RynUI 稳定公开组件与交互合同"
      ],
      "evidence_identifiers": [
        "source:components/divider/index.en-US.md"
      ]
    },
    {
      "identity": "ant.component.flex",
      "status": "partial",
      "summary": "RynUI 已提供 typed Flex 布局、方向、对齐、换行、gap 与 LayoutStyle 外部约束；尚未覆盖 Ant Design Flex 的全部响应式接口。",
      "supported_scope": [
        "horizontal and vertical layout",
        "align and justify",
        "wrap",
        "row/column gap",
        "LayoutStyle integration"
      ],
      "missing_scope": [
        "complete responsive breakpoint API",
        "all Ant Design Flex compatibility aliases"
      ],
      "evidence_identifiers": [
        "openspec:005-20260827-build-flex-and-space-layout-foundation",
        "test:rynui.flex_component",
        "test:rynui.flex_public_api"
      ]
    },
    {
      "identity": "ant.component.grid",
      "status": "planned",
      "summary": "栅格（Grid）的 Ant Design 6.5.0 参考条目；RynUI 尚未提供对应的稳定公开组件。",
      "supported_scope": [
        "仅保留锁定版本的离线参考元数据"
      ],
      "missing_scope": [
        "对应 RynUI 稳定公开组件与交互合同"
      ],
      "evidence_identifiers": [
        "source:components/grid/index.en-US.md"
      ]
    },
    {
      "identity": "ant.component.layout",
      "status": "planned",
      "summary": "布局（Layout）的 Ant Design 6.5.0 参考条目；RynUI 尚未提供对应的稳定公开组件。",
      "supported_scope": [
        "仅保留锁定版本的离线参考元数据"
      ],
      "missing_scope": [
        "对应 RynUI 稳定公开组件与交互合同"
      ],
      "evidence_identifiers": [
        "source:components/layout/index.en-US.md"
      ]
    },
    {
      "identity": "ant.component.masonry",
      "status": "planned",
      "summary": "瀑布流（Masonry）的 Ant Design 6.5.0 参考条目；RynUI 尚未提供对应的稳定公开组件。",
      "supported_scope": [
        "仅保留锁定版本的离线参考元数据"
      ],
      "missing_scope": [
        "对应 RynUI 稳定公开组件与交互合同"
      ],
      "evidence_identifiers": [
        "source:components/masonry/index.en-US.md"
      ]
    },
    {
      "identity": "ant.component.space",
      "status": "partial",
      "summary": "RynUI 已提供 typed Space 的方向、尺寸、换行与内容组合；尚未覆盖 Compact、split 等完整 Ant Design Space 能力。",
      "supported_scope": [
        "horizontal and vertical spacing",
        "typed size and custom logical gap",
        "wrap",
        "typed content composition"
      ],
      "missing_scope": [
        "Space.Compact",
        "split rendering",
        "complete Ant Design responsive size API"
      ],
      "evidence_identifiers": [
        "openspec:005-20260827-build-flex-and-space-layout-foundation",
        "test:rynui.space_component",
        "test:rynui.space_public_api"
      ]
    },
    {
      "identity": "ant.component.splitter",
      "status": "planned",
      "summary": "分隔面板（Splitter）的 Ant Design 6.5.0 参考条目；RynUI 尚未提供对应的稳定公开组件。",
      "supported_scope": [
        "仅保留锁定版本的离线参考元数据"
      ],
      "missing_scope": [
        "对应 RynUI 稳定公开组件与交互合同"
      ],
      "evidence_identifiers": [
        "source:components/splitter/index.en-US.md"
      ]
    },
    {
      "identity": "ant.component.anchor",
      "status": "planned",
      "summary": "锚点（Anchor）的 Ant Design 6.5.0 参考条目；RynUI 尚未提供对应的稳定公开组件。",
      "supported_scope": [
        "仅保留锁定版本的离线参考元数据"
      ],
      "missing_scope": [
        "对应 RynUI 稳定公开组件与交互合同"
      ],
      "evidence_identifiers": [
        "source:components/anchor/index.en-US.md"
      ]
    },
    {
      "identity": "ant.component.breadcrumb",
      "status": "planned",
      "summary": "面包屑（Breadcrumb）的 Ant Design 6.5.0 参考条目；RynUI 尚未提供对应的稳定公开组件。",
      "supported_scope": [
        "仅保留锁定版本的离线参考元数据"
      ],
      "missing_scope": [
        "对应 RynUI 稳定公开组件与交互合同"
      ],
      "evidence_identifiers": [
        "source:components/breadcrumb/index.en-US.md"
      ]
    },
    {
      "identity": "ant.component.dropdown",
      "status": "planned",
      "summary": "下拉菜单（Dropdown）的 Ant Design 6.5.0 参考条目；RynUI 尚未提供对应的稳定公开组件。",
      "supported_scope": [
        "仅保留锁定版本的离线参考元数据"
      ],
      "missing_scope": [
        "对应 RynUI 稳定公开组件与交互合同"
      ],
      "evidence_identifiers": [
        "source:components/dropdown/index.en-US.md"
      ]
    },
    {
      "identity": "ant.component.menu",
      "status": "planned",
      "summary": "导航菜单（Menu）的 Ant Design 6.5.0 参考条目；RynUI 尚未提供对应的稳定公开组件。",
      "supported_scope": [
        "仅保留锁定版本的离线参考元数据"
      ],
      "missing_scope": [
        "对应 RynUI 稳定公开组件与交互合同"
      ],
      "evidence_identifiers": [
        "source:components/menu/index.en-US.md"
      ]
    },
    {
      "identity": "ant.component.pagination",
      "status": "planned",
      "summary": "分页（Pagination）的 Ant Design 6.5.0 参考条目；RynUI 尚未提供对应的稳定公开组件。",
      "supported_scope": [
        "仅保留锁定版本的离线参考元数据"
      ],
      "missing_scope": [
        "对应 RynUI 稳定公开组件与交互合同"
      ],
      "evidence_identifiers": [
        "source:components/pagination/index.en-US.md"
      ]
    },
    {
      "identity": "ant.component.steps",
      "status": "planned",
      "summary": "步骤条（Steps）的 Ant Design 6.5.0 参考条目；RynUI 尚未提供对应的稳定公开组件。",
      "supported_scope": [
        "仅保留锁定版本的离线参考元数据"
      ],
      "missing_scope": [
        "对应 RynUI 稳定公开组件与交互合同"
      ],
      "evidence_identifiers": [
        "source:components/steps/index.en-US.md"
      ]
    },
    {
      "identity": "ant.component.tabs",
      "status": "planned",
      "summary": "标签页（Tabs）的 Ant Design 6.5.0 参考条目；RynUI 尚未提供对应的稳定公开组件。",
      "supported_scope": [
        "仅保留锁定版本的离线参考元数据"
      ],
      "missing_scope": [
        "对应 RynUI 稳定公开组件与交互合同"
      ],
      "evidence_identifiers": [
        "source:components/tabs/index.en-US.md"
      ]
    },
    {
      "identity": "ant.component.auto-complete",
      "status": "planned",
      "summary": "自动完成（AutoComplete）的 Ant Design 6.5.0 参考条目；RynUI 尚未提供对应的稳定公开组件。",
      "supported_scope": [
        "仅保留锁定版本的离线参考元数据"
      ],
      "missing_scope": [
        "对应 RynUI 稳定公开组件与交互合同"
      ],
      "evidence_identifiers": [
        "source:components/auto-complete/index.en-US.md"
      ]
    },
    {
      "identity": "ant.component.cascader",
      "status": "planned",
      "summary": "级联选择（Cascader）的 Ant Design 6.5.0 参考条目；RynUI 尚未提供对应的稳定公开组件。",
      "supported_scope": [
        "仅保留锁定版本的离线参考元数据"
      ],
      "missing_scope": [
        "对应 RynUI 稳定公开组件与交互合同"
      ],
      "evidence_identifiers": [
        "source:components/cascader/index.en-US.md"
      ]
    },
    {
      "identity": "ant.component.checkbox",
      "status": "planned",
      "summary": "多选框（Checkbox）的 Ant Design 6.5.0 参考条目；RynUI 尚未提供对应的稳定公开组件。",
      "supported_scope": [
        "仅保留锁定版本的离线参考元数据"
      ],
      "missing_scope": [
        "对应 RynUI 稳定公开组件与交互合同"
      ],
      "evidence_identifiers": [
        "source:components/checkbox/index.en-US.md"
      ]
    },
    {
      "identity": "ant.component.color-picker",
      "status": "planned",
      "summary": "颜色选择器（ColorPicker）的 Ant Design 6.5.0 参考条目；RynUI 尚未提供对应的稳定公开组件。",
      "supported_scope": [
        "仅保留锁定版本的离线参考元数据"
      ],
      "missing_scope": [
        "对应 RynUI 稳定公开组件与交互合同"
      ],
      "evidence_identifiers": [
        "source:components/color-picker/index.en-US.md"
      ]
    },
    {
      "identity": "ant.component.date-picker",